page	category	subcategory	name	url	tagline	description	notes	api
Health Tech	Drug information	General	Sider	http://sideeffects.embl.de/	SIDER contains information on marketed medicines and their recorded adverse drug reactions.			
General	Internet of things (IoT)	General	MQTT	https://mqtt.org/	MQTT is an OASIS standard messaging protocol for the Internet of Things (IoT). 			
General	Internet of things (IoT)	General	Node-RED	https://nodered.org/	"Node-RED is a programming tool for wiring together hardware devices, APIs and online services in new and interesting ways."			
Data	Data sources	Biomedical research	Terra	https://terra.bio/	"Access data, run analysis tools, and collaborate in Terra: a scalable platform for biomedical research."
Data	Databases	Graph	Neo4j	https://neo4j.com/	"Neo4j is a native graph database, built from the ground up to leverage not only data but also data relationships. Neo4j connects data as it's stored, enabling queries never before imagined, at speeds never thought possible."			
Data	Data sources	DEA	Automation of Reports and Consolidated Orders System (ARCOS)	https://www.deadiversion.usdoj.gov/arcos/index.html	"ARCOS is an automated, comprehensive drug reporting system which monitors the flow of DEA controlled substances from their point of manufacture through commercial distribution channels to point of sale or distribution at the dispensing/retail level - hospitals, retail pharmacies, practitioners, mid-level practitioners, and teaching institutions. "			
Data	Data sources	CMS	OpenPaymentsData.CMS.gov	https://openpaymentsdata.cms.gov/	The Open Payments Search Tool is used to search payments made by drug and medical device companies to physicians and teaching hospitals.			1
Coding	Front-end coding	Static site generators	Jamstack	https://jamstack.org/	The modern way to build websites and apps that delivers better performance.			
Data	Data sources	NIH / NINDS	Archived Clinical Research Datasets	https://www.ninds.nih.gov/Current-Research/Research-Funded-NINDS/Clinical-Research/Archived-Clinical-Research-Datasets	"The data from NINDS-supported clinical trials are an important scientific resource, made available to the wider scientific community, while ensuring that the confidentiality and privacy of study participants are protected."			
Data	Data sources	NIH / NLM	Open Domain-Specific Data Sharing Repositories	https://www.nlm.nih.gov/NIHbmic/domain_specific_repositories.html	Lists NIH-supported domain-specific data repositories that make data accessible for reuse and are open for both submitting and accessing data. 			
Health Tech	Genomics	General	BioJupies	https://amp.pharm.mssm.edu/biojupies/	"With BioJupies you can produce in seconds a customized, reusable, and interactive report from your own raw or processed RNA-seq data through a simple user interface."			
Data	Data sources	NIH / ODSS	STRIDES Initiative	https://datascience.nih.gov/strides	"The NIH Science and Technology Research Infrastructure for Discovery, Experimentation, and Sustainability (STRIDES) Initiative allows NIH to explore the use of cloud environments to streamline NIH data use by partnering with commercial providers. "			
Coding	Front-end coding	Static site generators	VuePress	https://vuepress.vuejs.org/	A Vue-powered static site generator.			
Data	Data sources	General	Health and Retirement Study (HRS) Data Products	https://hrs.isr.umich.edu/data-products	"The University of Michigan Health and Retirement Study (HRS) is a longitudinal panel study that surveys a representative sample of approximately 20,000 people in America, supported by the National Institute on Aging (NIA U01AG009740) and the Social Security Administration."		
Data	Data sources	U.S. Government	Data.gov	https://www.data.gov/	The home of the U.S. Government's open data			1
Data	Data sources	Synthetic patient data	Mimic	https://mimic.physionet.org/	"MIMIC is an openly available dataset developed by the MIT Lab for Computational Physiology, comprising deidentified health data associated with ~60,000 intensive care unit admissions. It includes demographics, vital signs, laboratory tests, medications, and more."			
Data	Data sources	General	The Human Mortality Database	https://www.mortality.org/	"The Human Mortality Database (HMD) was created to provide detailed mortality and population data to researchers, students, journalists, policy analysts, and others interested in the history of human longevity."			
Data	Data sources	NIH / NCI	Genomic Data Commons Data Portal	https://portal.gdc.cancer.gov/	The GDC Data Portal is a robust data-driven platform that allows cancer researchers and bioinformaticians to search and download cancer data for analysis.			1
Health Tech	Interoperability	General	OpenNotes	https://www.opennotes.org/	OpenNotes is the international movement promoting and studying transparent communication in healthcare.			
Health Tech	Interoperability	General	Center for Medical Interoperability	https://medicalinteroperability.org/	The Center for Medical Interoperability is a 501(c)(3) cooperative research and development lab founded by health systems to simplify and advance data sharing among medical technologies and systems. 			
Coding	Front-end coding	Static site generators	MkDocs	https://squidfunk.github.io/mkdocs-material/	"Create a branded static site from a set of Markdown files to host the documentation of your Open Source or commercial project  customizable, searchable, mobile-friendly, 40+ languages. Set up in 5 minutes."			
Coding	Front-end coding	Design frameworks	Shoelace	https://shoelace.style/	A forward-thinking library of web components.			
Health Tech	SMART	General	Smart Health Cards Framework	https://smarthealth.cards/	"This implementation guide provides a framework for ""Health Cards"", with a short term goal to enable a consumer to receive COVID-19 Vaccination or Lab results and present these results to another party in a verifiable manner."			
Health Tech	Structured data extraction	Biomedical research	SPECIALIST NLP Tools	https://lexsrv3.nlm.nih.gov/Specialist/Home/index.html	The SPECIALIST Natural Language Processing (NLP) Tools have been developed by the The Lexical Systems Group of The Lister Hill National Center for Biomedical Communications to investigate the contributions that natural language processing techniques can make to the task of mediating between the language of users and the language of online biomedical information resources.			
Coding	Front-end coding	Static site generators	GitBook	https://www.gitbook.com/	"Document Everything! For you, your users and your team"			
Coding	Front-end coding	Static site generators	HonKit	https://github.com/honkit/honkit	HonKit is building beautiful books using GitHub/Git and Markdown.			
Health Tech	FHIR	General	1upHealth FHIR API Quick Start Guide	https://1up.health/docs/start/quick-start-guide	"1upHealth provides a common RESTful API across 10,000+ health centers (our network) with more added each month. "			1
Coding	Front-end coding	Design frameworks	LitElement	https://lit-element.polymer-project.org/	"A simple base class for creating fast, lightweight web components."			
Health Tech	FDA	General	Drug Supply Chain Security Act (DSCSA)	https://www.fda.gov/drugs/drug-supply-chain-integrity/drug-supply-chain-security-act-dscsa	"Outlines steps to build an electronic, interoperable system to identify and trace certain prescription drugs as they are distributed in the United States. "			
Health Tech	Blockchain	General	Blockchain in Healthcare	https://www.himss.org/resources/blockchain-healthcare	"To understand blockchain in healthcare, it is important to have a foundation about how this particular type of distributed ledger technology (DLT) works and how it can be applied to the broader healthcare ecosystem."			
Health Tech	FHIR	General	Intro to FHIR	https://1up.health/docs/start/introduction-to-fhir	"This article is meant as a FHIR 101, or FHIR for dummies. "			
Coding	APIs	General	Sheety	https://sheety.co/	"Thousands of people are using Sheety to turn their spreadsheets into powerful APIs to rapidly develop prototypes, websites, apps and more."			1
Health Tech	APIs	General	Human API	https://www.humanapi.co/	"The Human API platform connects to US hospitals, clinics, patient portals, pharmacies, labs, HIEs, EHR networks, offline records retrieval partners, wearable devices, and fitness apps, enabling companies to build new technologies and deliver better experiences to customers and users. "			1
Health Tech	APIs	General	Redox	https://developer.redoxengine.com/	"Redox is an EHR Integration API that connects your product to healthcare organizations while eliminating infrastructure requirements, data transformation tasks, and security overhead of bespoke integration methods."			1
Health Tech	APIs	General	1upHealth	https://1up.health/	1upHealth provides 100s of health tech companies and systems with the tools they need to create easy and accessible experiences for their users.			1
Coding	Front-end coding	Prototyping	Figma	https://www.figma.com/	"Figma helps teams create, test, and ship better designs from start to finish."			
Coding	Front-end coding	Prototyping	Draw.io	https://draw.io/	Wireframe and flowchart creation tool that allows for collaboration.			
Health Tech	APIs	Reference	ONC API Resource Guide	https://www.healthit.gov/sites/default/files/page/2020-11/API-Resource-Guide_v1_0.pdf	Version 1.0			
Health Tech	Drug information	FDA	FDA.report	https://fda.report/	"Provides access to all FDA databases in a single portal where food, drugs, companies and studies are all linked together for easy navigation and informaiton discovery."			
Coding	R	Utilities	ndc_map	https://github.com/fabkury/ndc_map	"This script provides the drug class (or classes) from a given drug classification system (e.g. ATC) of each FDA National Drug Code (NDC), if any is available. "			
Health Tech	Drug information	FDA	National Drug Code Directory	https://www.accessdata.fda.gov/scripts/cder/ndc/index.cfm				
Data	Notebooks	JavaScript	Observable	https://observablehq.com/product	"Explore and visualize data. Share and publish your insights. Discover and be inspired."
Data	Notebooks	General	Deep Note	https://deepnote.com/	"Deepnote is a new kind of data science notebook. Jupyter-compatible with real-time collaboration and running in the cloud. Oh, and it's free."			
