page	category	subcategory	name	url	tagline	description	notes	api
Health Tech	Drug information	FDA	FDALabel	https://www.fda.gov/science-research/bioinformatics-tools/fdalabel-full-text-search-drug-labeling	Web-based application to search labeling documents of FDA-approved drug products	"The FDALabel Database is a web-based application used to perform customizable searches of over 130,000 human prescription, biological, over-the-counter (OTC), and animal drug labeling documents. The source of FDALabel's data is the FDA's Structured Product Labeling (SPL) archive, which stores labeling documents submitted by manufacturers. FDALabel is implemented as a secure three-tier application with an Oracle database."		
Health Tech	Drug information	FDA	openFDA	https://open.fda.gov/	"openFDA provides APIs and raw download access to a number of high-value, high priority and scalable structured datasets, including adverse events, drug product labeling, and recall enforcement reports."	"openFDA is the first innovation created by Taha Kass-Hout, MD, MS, upon joining FDA as the first Chief Health Information Officer in March 2013. The goal of the project is to create easy access to public data, to create a new level of openness and accountability, to ensure the privacy and security of public FDA data, and ultimately to educate the public and save lives. The concept was to index high-value, high priority and scalable public-access data, format and document that data in developer and consumer-friendly standards, and make that data available via a public-access portal that enables developers to quickly and easily use it in applications. Dr. Kass-Hout launched the project by obtaining a Presidential Innovation Fellow to focus on policy and programmatic issues in July 2013. The public cloud environment was determined in September 2013, and Dr. Kass-Hout's team solicited agency and user input into policies, first priority datasets, and desirable technical characteristics of openFDA. All the project milestones were met despite the government shutdown."		1
Coding	Front-end coding	Design	Colormind	http://colormind.io/	"Colormind is a color scheme generator that uses deep learning. It can learn color styles from photographs, movies, and popular art."		Has an API	1
Coding	Front-end coding	Design	Coolors	https://coolors.co/	The super fast color schemes generator!			
Coding	Front-end coding	Design	Divjoy	https://divjoy.com/	The React codebase generator		Also works with Next.js	
Coding	Front-end coding	ReactJS	React Bootstrap Typeahead	https://github.com/ericgio/react-bootstrap-typeahead/blob/master/docs/API.md	A React-based typeahead that relies on Bootstrap for styling and was originally inspired by Twitter's typeahead.js. It supports both single- and multi-selection and is compliant with WAI-ARIA authoring practices.			
Coding	Front-end coding	Design	58 Bytes of CSS	https://jrl.ninja/etc/1/	58 bytes of CSS to look great nearly everywhere			
Coding	Front-end coding	Design frameworks	Tailwind UI	https://tailwindui.com/	"Fully responsive HTML components, designed and developed by Adam Wathan and Steve Schoger."			
Coding	Front-end coding	Design frameworks	Tailwind CSS	https://tailwindcss.com/	"A utility-first CSS framework packed with classes like flex, pt-4, text-center and rotate-90 that can be composed to build any design, directly in your markup."			
Coding	Front-end coding	Visualization	visx	https://github.com/airbnb/visx	visx is a collection of reusable low-level visualization components. visx combines the power of d3 to generate your visualization with the benefits of react for updating the DOM.			
Coding	Front-end coding	Design	Paaatterns	https://products.ls.graphics/paaatterns/	Free collection of beautiful patterns for all vector formats	"When you need a strong visual style, but the deadline is close, try using our patterns interesting hand-crafted shapes and well-chosen colors will help when there are out of ideas."		
Coding	Front-end coding	Design	1-Line Layouts	https://1linelayouts.glitch.me/	10 Modern CSS layout and sizing techniques that highlight just how robust and impactful a single-line of styling code can be.			
Coding	Front-end coding	Visual tools	PixiJS	https://www.pixijs.com/	"The HTML5 Creation Engine: Create beautiful digital content with the fastest, most flexible 2D WebGL renderer."			
Coding	Front-end coding	Visual tools	ct.js	https://ctjs.rocks/	"ct.js makes learning programming fun and game development easy by its visual tools, good docs and flexible, modular library."			
Health Tech	Drug information	NIH / NLM	RxTerms	https://mor.nlm.nih.gov/RxTerms/	"RxTerms is a drug interface terminology derived from RxNorm for prescription writing or medication history recording (e.g. in e-prescribing systems, PHRs)."			
Health Tech	Drug information	NIH / NLM	RxTerms Search	https://rxterms.nlm.nih.gov/	A demo of the RxTerms prescription drug data	"This simple form demonstrates how the data in RxTerms can be used to support medications data entry, for example, in an e-prescribing or Computerized Provider Order Entry (CPOE) application."		
Health Tech	Search	General	Clinical Table Search Service	https://clinicaltables.nlm.nih.gov/	A web API service for use with autocomplete-lhc & LHC-Forms	"Clinical Table Search Service (formerly ""lforms-service"") is a web service which software programs can use for querying clinical data tables. The API for each table is designed to work with our form field autocompletion package, but can be used by other programs as well. The tables may also be accessed through the FHIR operations APIs. Please let us know if there are other clinical data tables you would like to see here."		1
Health Tech	Funding	General	NLM Extramural Programs	https://www.nlm.nih.gov/ep/index.html	The Extramural Programs (EP) Division of the National Library of Medicine (NLM) offers grants for research projects and research training in biomedical informatics and data science. 	"Grants are available for a wide range of innovative basic and applied biomedical informatics research projects. Fields of interest include: computational representation of biomedical knowledge; integration, organization and retrieval in very large databases, disparate forms of knowledge, and multiple datasets; enhancement of human intellectual capacities through virtual reality, artificial intelligence, and machine learning; support for health decisions; in silico science; natural language understanding; investigations of topics relevant to health information science, computational modeling, and management of information during disasters. NLM places priority on research that is novel, significant, and of high impact."		
Health Tech	Funding	General	ASHP Grants and Awards	https://www.ashpfoundation.org/Grants-and-Awards	Committed to advancing practice by funding pharmacist researchers and residency expansion.			
Coding	Python	Utilities	pytest-django	https://pytest-django.readthedocs.io/en/latest/	pytest-django is a plugin for pytest that provides a set of useful tools for testing Django applications and projects.			
Health Tech	Drug information	NIH / NLM	RxNav in a Box	https://rxnav.nlm.nih.gov/RxNav-in-a-Box.html	"RxNav-in-a-Box provides users with a locally-installable version of RxNav, RxClass, and RESTful companion APIs, including RxNorm, Prescribable, RxTerms, RxClass, and drug-drug interactions."			
Coding	Back-end coding	Computer vision	Tesseract OCR	https://github.com/tesseract-ocr/tesseract	"Tesseract is an open source text recognition (OCR) Engine, available under the Apache 2.0 license."			
Coding	Python	Utilities	Black	https://github.com/psf/black	The Uncompromising Code Formatter	"Black is the uncompromising Python code formatter. By using it, you agree to cede control over minutiae of hand-formatting. In return, Black gives you speed, determinism, and freedom from pycodestyle nagging about formatting. You will save time and mental energy for more important matters."		
Health Tech	Drug information	FDA	pharmpy	https://pypi.org/project/pharmpy/	"pharmpy is an umbrella Python library for searching the FDA NDC directory, Established Pharmacologic Class (EPC), Anatomical Therapeutic Chemical (ATC) through RxNav, and some other APIs on RxNav."			
Coding	Python	Utilities	pyenv	https://github.com/pyenv/pyenv	Simple Python Version Management	"pyenv lets you easily switch between multiple versions of Python. It's simple, unobtrusive, and follows the UNIX tradition of single-purpose tools that do one thing well."		
Coding	Back-end coding	Scraping	Scrapy	https://docs.scrapy.org/en/latest/index.html	"Scrapy is a fast high-level web crawling and web scraping framework, used to crawl websites and extract structured data from their pages. It can be used for a wide range of purposes, from data mining to monitoring and automated testing."			
Coding	Back-end coding	Scraping	Webscraper.io	https://www.webscraper.io/	Making web data extraction easy and accessible for everyone			
Coding	Front-end coding	Static site generators	Jekyll	https://jekyllrb.com/	Transform your plain text into static websites and blogs.			
Coding	Hosting	General	GitHub Pages	https://pages.github.com/	"Websites for you and your projects.osted directly from your GitHub repository. Just edit, push, and your changes are live."			1
Health Tech	Drug information	NIH / NLM	RxNorm	https://www.nlm.nih.gov/research/umls/rxnorm/index.html	"RxNorm provides normalized names for clinical drugs and links its names to many of the drug vocabularies commonly used in pharmacy management and drug interaction software, including those of First Databank, Micromedex, and Gold Standard Drug Database. By providing links between these vocabularies, RxNorm can mediate messages between systems not using the same software and vocabulary."			1
Data	Data sources	CMS	CMS 2008-2010 Data Entrepreneurs Synthetic Public Use File (DE-SynPUF)	https://www.cms.gov/Research-Statistics-Data-and-Systems/Downloadable-Public-Use-Files/SynPUFs/DE_Syn_PUF	The DE-SynPUF was created with the goal of providing a realistic set of claims data in the public domain while providing the very highest degree of protection to the Medicare beneficiaries protected health information. 	"The DE-SynPUF was created with the goal of providing a realistic set of claims data in the public domain while providing the very highest degree of protection to the Medicare beneficiaries protected health information. The purposes of the DE-SynPUF are to: allow data entrepreneurs to develop and create software and applications that may eventually be applied to actual CMS claims data; train researchers on the use and complexity of conducting analyses with CMS claims data prior to initiating the process to obtain access to actual CMS data; and, support safe data mining innovations that may reveal unanticipated knowledge gains while preserving beneficiary privacy. The files have been designed so that programs and procedures created on the DE-SynPUF will function on CMS Limited Data Sets. The data structure of the Medicare DE-SynPUF is very similar to the CMS Limited Data Sets, but with a smaller number of variables. The DE-SynPUF also provides a robust set of metadata on the CMS claims data that have not been previously available in the public domain. Although the DE-SynPUF has very limited inferential research value to draw conclusions about Medicare beneficiaries due to the synthetic processes used to create the file, the Medicare DE-SynPUF does increase access to a realistic Medicare claims data file in a timely and less expensive manner to spur the innovation necessary to achieve the goals of better care for beneficiaries and improve the health of the population. The DE-SynPUF contains five types of data Beneficiary Summary, Inpatient Claims, Outpatient Claims, Carrier Claims, and Prescription Drug Events."		
Data	Data sources	Synthetic patient data	Synthea GitHub	https://github.com/synthetichealth/synthea	"Synthea is a Synthetic Patient Population Simulator. The goal is to output synthetic, realistic (but not real), patient data and associated health records in a variety of formats."			
Data	Data sources	Synthetic patient data	Synthea FHIR API	https://synthea.mitre.org/downloads				1
Data	Data sources	Synthetic patient data	Synthea CSV Downloads	https://synthea.mitre.org/downloads				
Coding	Front-end coding	JavaScript	Vue.js	https://vuejs.org/	The Progressive JavaScript Framework			
Coding	Front-end coding	JavaScript	Svelte	https://svelte.dev/	Cybernetically enhanced web apps	"Svelte is a radical new approach to building user interfaces. Whereas traditional frameworks like React and Vue do the bulk of their work in the browser, Svelte shifts that work into a compile step that happens when you build your app."		
Health Tech	Standards	FHIR	FHIRcast	https://fhircast.org/	"Modern, simple application context synchronization"	"FHIRcast synchronizes healthcare applications in real time to show the same clinical content to a common user. For example, a radiologist often works in three disparate applications at the same time (a radiology information system, a PACS and a dictation system), she wants each of these three systems to display the same study or patient at the same time."		
Health Tech	Standards	FHIR	FHIR	http://hl7.org/fhir/	"FHIR is a standard for health care data exchange, published by HL7."	"FHIR aims to simplify implementation without sacrificing information integrity. It leverages existing logical and theoretical models to provide a consistent, easy to implement, and rigorous mechanism for exchanging data between healthcare applications. FHIR has built-in mechanisms for traceability to the HL7 RIM and other important content models. This ensures alignment to HL7's previously defined patterns and best practices without requiring the implementer to have intimate knowledge of the RIM or any HL7 v3 derivations. (See Comparing FHIR to other HL7 standards)."		
Health Tech	Azure	FHIR	FHIR Converter	https://github.com/microsoft/fhir-converter	FHIR Converter is an open source project that enables conversion of health data from legacy formats to FHIR.			
Health Tech	Azure	FHIR	FHIR Tools for Anonymization	https://github.com/microsoft/fhir-tools-for-anonymization	"FHIR Tools for Anonymization is an open-source project that helps anonymize healthcare FHIR data, on-premises or in the cloud, for secondary usage such as research, public health, and more."			
Health Tech	Azure	FHIR	HealthKitOnFhir	https://github.com/microsoft/healthkit-on-fhir	HealthKitOnFhir is a Swift library that automates the export of Apple HealthKit Data to a FHIR Server.			
Health Tech	Azure	FHIR	IoMT FHIR Connector for Azure	https://github.com/microsoft/iomt-fhir	The IoMT FHIR Connector for Azure is an open-source project for ingesting data from IoMT (internet of medical things) devices and persisting the data in a FHIR server.			
Data	Data sources	Research	All of Us Data Browser	https://databrowser.researchallofus.org/	The Data Browser provides interactive views of the publicly available All of Us Research Program participant data. 			
Data	Data sources	CMS	Medicare Provider Utilization and Payment Data	https://www.cms.gov/Research-Statistics-Data-and-Systems/Statistics-Trends-and-Reports/Medicare-Provider-Charge-Data	"CMS has released a series of publicly available data files that summarize the utilization and payments for procedures, services, and prescription drugs provided to Medicare beneficiaries by specific inpatient and outpatient hospitals, physicians, and other suppliers."			
Data	Data sources	CMS	"Research, Statistics, Data & Systems"	https://www.cms.gov/Research-Statistics-Data-and-Systems/Research-Statistics-Data-and-Systems				
Health Tech	Drug information	NIH / NLM	python-daily-med	https://github.com/LasLabs/python-daily-med	This library interacts with the United States National Library of Medicine's Daily Med API.			
Health Tech	Drug information	NIH / NLM	DailyMed	https://dailymed.nlm.nih.gov/dailymed/	"DailyMed provides trustworthy information about marketed drugs in the United States. DailyMed is the official provider of FDA label information (package inserts). This Web site provides a standard, comprehensive, up-to-date, look-up and download resource of medication content and labeling found in medication package inserts."			
Health Tech	Medical devices	FDA	AccessGUDID	https://accessgudid.nlm.nih.gov/	The Global Unique Device Identification Database (GUDID) contains key device identification information submitted to the FDA about medical devices that have Unique Device Identifiers (UDI).			
Data	Data sources	CMS	Medicare Part B Drug Average Sales Price	https://www.cms.gov/Medicare/Medicare-Fee-for-Service-Part-B-Drugs/McrPartBDrugAvgSalesPrice	Manufacturer reporting of Average Sales Price (ASP) data			
Coding	Front-end coding	Static site generators	React Static	https://github.com/react-static/react-static				
Health Tech	Structured data extraction	Medications	medExtractR	https://cran.r-project.org/web/packages/medExtractR/index.html	Extraction of Medication Information from Clinical Text			
Health Tech	Structured data extraction	Medications	ParseRx	https://parserx.io/	Medication sig parser	"Designed, built, and tested by a pharmacist to structure free-text medication sigs. Parse dose, frequency, duration, and more from medication sigs. Calculate total dose to power clinical decision support. Save valuable clinician time by automating medication sig entry."		1
Health Tech	Structured data extraction	Medications	MedXN	https://pubmed.ncbi.nlm.nih.gov/24637954/	An open source medication extraction and normalization tool for clinical text			
Health Tech	Structured data extraction	Medications	MedEx	https://www.vumc.org/cpm/cpm-blog/medex-tool-finding-medication-information	"MedEx processes free-text clinical records to recognize medication names and signature information, such as drug dose, frequency, route, and duration. "			
Coding	Back-end coding	APIs	Django Rest Framework	https://www.django-rest-framework.org/	Django REST framework is a powerful and flexible toolkit for building Web APIs.			
Coding	Back-end coding	APIs	Flask	https://flask.palletsprojects.com/en/1.1.x/	"Flask is a lightweight WSGI web application framework. It is designed to make getting started quick and easy, with the ability to scale up to complex applications."			
Coding	Chat bots	General	Microsoft Bot Framework	https://github.com/microsoft/BotBuilder-Samples	"Task-focused samples in C#, JavaScript and TypeScript to help you get started with the Bot Framework SDK."			
Coding	Chat bots	General	ChatterBot	https://github.com/gunthercox/ChatterBot	"Machine learning, conversational dialog engine."	ChatterBot is a machine-learning based conversational dialog engine build in Python which makes it possible to generate responses based on collections of known conversations. The language independent design of ChatterBot allows it to be trained to speak any language.		
Coding	Hosting	General	DigitalOcean	https://www.digitalocean.com/solutions/website-hosting/	"Simple to launch in the cloud and scale up as you grow with an intuitive control panel, predictable pricing, team accounts, and more."			
Data	Data sources	HCPCS	Addendum A and Addendum B Updates	https://www.cms.gov/Medicare/Medicare-Fee-for-Service-Payment/HospitalOutpatientPPS/Addendum-A-and-Addendum-B-Updates	"A ""snapshot"" of HCPCS codes and their status indicators, APC groups, and OPPS payment rates, that are in effect at the beginning of each quarter."	"Updates of Addendum A and B are posted quarterly to the OPPS website. These addenda are a ""snapshot"" of HCPCS codes and their status indicators, APC groups, and OPPS payment rates, that are in effect at the beginning of each quarter. The quarterly updates of Addendum A and Addendum B reflect the OPPS Pricer changes that are part of the quarterly OPPS recurring update notification transmittals."		
Data	Data sources	HCPCS	National Correct Coding Initiative Edits	https://www.cms.gov/Medicare/Coding/NationalCorrectCodInitEd	The CMS developed the National Correct Coding Initiative (NCCI) to promote national correct coding methodologies and to control improper coding leading to inappropriate payment in Part B claims.			
Health Tech	Drug information	General	NDC List	https://ndclist.com/	The complete repository of National Drug Codes Information.			
Health Tech	Drug information	General	DrugCentral	https://drugcentral.org/	DrugCentral is online drug information resource created and maintained by Division of Translational Informatics at University of New Mexico in collaboration with the IDG.	"DrugCentral provides information on active ingredients chemical entities, pharmaceutical products, drug mode of action, indications, pharmacologic action. We monitor FDA, EMA, and PMDA for new drug approval on regular basis to ensure currency of the resource. Limited information on discontinued and drugs approved outside US is also available however regulatory approval information can't be verified."		
Health Tech	Drug information	General	DrugBank	https://go.drugbank.com/	A pharmaceutical knowledge base that is enabling major advances across the data-driven medicine industry.	"The knowledge base consists of proprietary authored content describing clinical level information about drugs such as side effects and drug interactions, as well as molecular level data such as chemical structures and what proteins a drug interacts with. DrugBank offers a suite of products powered by the DrugBank Platform and has customers located around the world crossing multiple industries including precision medicine, electronic health records, drug development and regulatory agencies. DrugBank also provides DrugBank Online as a free-to-access resource for academic research and is used by millions of pharmacists, pharmacologists, health professionals and pharmaceutical researchers every year."		
Coding	Open Source	Synthea	Generic Module Framework	https://github.com/synthetichealth/synthea/wiki/Generic-Module-Framework	Synthea contains a framework for defining modules using JSON. These JSON modules describe a progression of states and the transitions between them. 			
Data	Data sources	Medicaid	Data.Medicaid.gov	https://data.medicaid.gov/	The home of Medicaid & CHIP open data.			1
Data	Data sources	CMS	Data.CMS.gov	https://data.cms.gov/	Data that helps you better understand CMS programs.			1
Coding	Python	Utilities	sodapy	https://github.com/xmunoz/sodapy	A python client for the Socrate Open Data API (CMS / Medicaid).			
Data	Data sources	AHRQ	Medical Expenditure Panel Survey (MEPS)	https://meps.ahrq.gov/mepsweb/data_stats/data_overview.jsp	"MEPS collects data on the specific health services that Americans use, how frequently they use them, the cost of these services, and how they are paid for, as well as data on the cost, scope, and breadth of health insurance held by and available to U.S. workers."			
Data	Data sources	AHRQ	MEPS Summary Tables	https://meps.ahrq.gov/mepstrends/home/index.html	"The MEPS Household Component summary tables provide frequently used summary estimates for the U.S. civilian noninstitutionalized population on household medical utilization and expenditures, demographic and socio-economic characteristics, health insurance coverage, access to care and experience with care, medical conditions, and prescribed medicine purchases."			
Data	Data sources	NIH / NLM	Unified Medical Language System (UMLS)	https://documentation.uts.nlm.nih.gov/rest/home.html	"The UMLS integrates and distributes key terminology, classification and coding standards, and associated resources to promote creation of more effective and interoperable biomedical information systems and services, including electronic health records."			
Data	Data sources	AHRQ	MEPS Prescribed Medicines Files	https://meps.ahrq.gov/mepsweb/data_stats/download_data_files_results.jsp?cboDataYear=All&cboDataTypeY=2%2CHousehold+Event+File&buttonYearandDataType=Search&cboPufNumber=All&SearchTitle=Prescribed+Medicines	Contains household prescribed medicines event files.			
Data	Data sources	AHRQ	MEPS Summary Tables: Prescribed drugs	https://meps.ahrq.gov/mepstrends/hc_pmed/	"These MEPS summary tables provide statistics on total expenditures, total purchases, and number of persons with purchases for prescription medicines or therapeutic class groups."			
Health Tech	Drug information	NIH / NLM	Unified Medical Language System (UMLS)	https://www.nlm.nih.gov/research/umls/index.html	"The UMLS integrates and distributes key terminology, classification and coding standards, and associated resources to promote creation of more effective and interoperable biomedical information systems and services, including electronic health records."			1
Coding	Python	Utilities	uts-rest-api	https://github.com/HHS/uts-rest-api/tree/master/samples/python	"This repository features code samples that show how to use the Unified Medical Language System (UMLS) Terminology Services REST API."			
Data	Data sources	NIH / NLM	ClinicalTrials.gov	https://clinicaltrials.gov/api/	ClinicalTrials.gov is a database of privately and publicly funded clinical studies conducted around the world.			1
Coding	Front-end coding	Design frameworks	U.S. Web Design System (USWDS) Components	https://designsystem.digital.gov/components/	USWDS components are designed to set a new bar for simplicity and consistency across government services.			
Coding	Front-end coding	Design frameworks	CMS Design System	https://design.cms.gov/	"The design system is a set of open source design and front-end development resources for creating Section 508 compliant, responsive, and consistent websites."			
Coding	Front-end coding	Usability	Usability.gov	https://www.usability.gov/	Improving the user experience			
